{
  "$schema": "./phase1-gate.schema.json",
  "schemaVersion": 1,
  "asOf": "2026-08-30",
  "profileId": "iphone14-ios26.6-phase1-v1",
  "gateStatus": "passed",
  "packages": {
    "WP-101": {
      "status": "accepted",
      "evidence": "docs/evidence/WP-101.md"
    },
    "WP-102": {
      "status": "accepted",
      "evidence": "docs/evidence/WP-102.md"
    },
    "WP-103": {
      "status": "accepted",
      "evidence": "docs/evidence/WP-103.md"
    },
    "WP-104": {
      "status": "accepted",
      "evidence": "docs/evidence/WP-104.md"
    },
    "WP-105": {
      "status": "accepted",
      "evidence": "docs/evidence/WP-105.md"
    },
    "WP-106": {
      "status": "accepted",
      "evidence": "docs/evidence/WP-106.md"
    },
    "WP-107": {
      "status": "accepted",
      "evidence": "docs/evidence/WP-107.md"
    },
    "WP-108": {
      "status": "accepted",
      "evidence": "docs/evidence/WP-108.md"
    },
    "WP-109": {
      "status": "accepted",
      "evidence": "docs/evidence/WP-109.md"
    }
  },
  "acceptance": {
    "automatedCore": {
      "status": "passed",
      "evidence": "pnpm test:phase1"
    },
    "trackerCorrectness": {
      "status": "waived",
      "evidence": "Owner waiver PHASE1-PHYSICAL-2026-08-30; exact-candidate revalidation not performed"
    },
    "memorySmoke": {
      "status": "waived",
      "evidence": "Owner waiver PHASE1-PHYSICAL-2026-08-30; exact-candidate 30-minute smoke not completed"
    },
    "voiceOver": {
      "status": "waived",
      "evidence": "Owner waiver PHASE1-PHYSICAL-2026-08-30; corrected VoiceOver flow remains unverified"
    },
    "dynamicType": {
      "status": "waived",
      "evidence": "Owner waiver PHASE1-PHYSICAL-2026-08-30; corrected largest-text layout remains unverified"
    },
    "elevation": {
      "status": "waived",
      "evidence": "Owner waiver PHASE1-PHYSICAL-2026-08-30; corrected barometric sampling remains unverified"
    }
  },
  "deferred": {
    "measuredEnergy": "WP-307/WP-503"
  },
  "waivers": [
    {
      "id": "PHASE1-PHYSICAL-2026-08-30",
      "status": "approved",
      "approvedAt": "2026-08-30",
      "approvedBy": "project owner",
      "scope": ["trackerCorrectness", "memorySmoke", "voiceOver", "dynamicType", "elevation"],
      "reason": "The project owner explicitly waived the remaining physical tests and accepted WP-101 through WP-109.",
      "residualRisk": "The replacement exact candidate has not demonstrated the corrected elevation and accessibility behavior or repeated tracker and memory results on the reference iPhone."
    }
  ]
}
